decision_id,priority,decision_item,availability_status,linked_gap_ids,linked_artifacts,runtime_status,dashboard_treatment,why_needed,recommended_resolution
future_nominal_ped_fed_rates_by_scenario,critical,Future nominal PED/FED rates by scenario,source_backed,fed_path_scenario_values_missing; ped_total_vkt_bridge_missing,data/current_revenue_outlook/revenue_chart_rows.csv; fed_rate_paths.csv; ped_bridge_inputs.csv; official_befu25_annual.csv; hybrid_annual_revenue.csv; source_gap_register.csv,fed_rate_path_and_total_vkt_source_backed,"Recompute PED revenue from repo-vendored VKT per capita, population, source-backed litres intensity and FED rate paths.",Converts PED litres to nominal revenue and affects retail petrol-price scenarios.,Add explicit nominal rate paths to reviewed scenario workbooks or a governed rate table; keep Crown top-up separate.
future_nominal_effective_light_heavy_ruc_rates,critical,Future nominal effective Light/Heavy RUC rates,source_backed,release_value_table_missing,data/current_revenue_outlook/revenue_chart_rows.csv; official_befu25_annual.csv; hybrid_annual_revenue.csv; source_gap_register.csv,source_derived_effective_rate_replay,Recompute Light/Heavy RUC revenue from repo-vendored net-km rows and source-derived effective rates; keep independent nominal rate tables as a provenance limitation.,Converts net km into revenue; Heavy RUC is class-mix weighted.,Provide scenario/year effective average rate paths with source and class-mix assumptions.
ped_bridge_source_history_and_re_estimation,critical,PED bridge source history and re-estimation,source_backed,ped_total_vkt_bridge_missing,ped_bridge_inputs.csv; source_gap_register.csv; hybrid_annual_revenue.csv,bridge_rows_available,"Use the repo-vendored PED bridge rows for population, total VKT and source-backed litres intensity; do not infer missing training-history rows from validation forecasts.",The current app pack reports ped_bridge_source_history_missing.,Use accrual PED revenue/base-rate history from 2008Q3 onward; replay Table 3.3 and re-estimate on current data with rolling validation.
pass_through_policy_for_lpg_cng_fed_refunds_mvr_and_tuc,high,"Pass-through policy for LPG, CNG, FED refunds, MVR and TUC",source_backed,release_value_table_missing; quarterly_source_pack_missing,release_registry.csv; source_gap_register.csv; pass-through value table not vendored,official_release_path_missing,Use explicit source rows where present and show missing release-value paths instead of fabricating pass-through totals.,Only PED/Light/Heavy RUC are directly modeled; Total NLTF requires the other lines.,Use an explicit MOT release path where available; otherwise use a governed assumption with status and source.
ruc_gross_net_admin_refund_basis,high,RUC gross/net/admin/refund basis,source_backed,release_value_table_missing,aggregation_rules.csv; canonical_revenue_long.csv; source_gap_register.csv,basis_components_partial,"Keep gross, admin, refunds and net basis as separate governed series where source rows exist.",The workbook scales modeled RUC components to the official net-of-admin/refunds basis.,"Store gross, admin, refunds and net as separate canonical series and calculate the selected basis explicitly."
crown_top_up_policy,high,Crown top-up policy,source_backed,crown_top_up_values_missing,front_end_config.json; source_gap_register.csv,policy_overlay_missing_values,Persist Include/Exclude selection and warn when Include is requested without governed top-up value rows.,Temporary relief changes benchmark actuals and total comparisons.,Keep an Include/Exclude control and persist the choice in the run manifest.
h13_treatment,medium,H13+ treatment,label_applied,,forecast horizon labels; current_revenue_outlook manifest,label_applied,Label H1-H12 as backtest-supported and H13+ as long-range extrapolation or assumption; no value changes.,Econometric performance is validated to 12 quarters while the workbook projects to 2050.,Label H1–H12 backtest-supported and H13+ long-range extrapolation/assumption.
