gap_id,required_for,availability_status,current_selection,runtime_treatment,user_visible_message
release_value_table_missing,selected MOT/BEFU and rolling BEFU 1Y release paths,missing,BEFU25,registry_only,Full MOT/BEFU release-value table is unavailable; release selection is registry-only and unresolved differences are reported.
fed_path_scenario_values_missing,FED path scenario control and 2027 12c uplift treatment,missing,Current planned path,registry_only,FED path scenario values are not separately vendored; the FED path control is registry-only and revenue rows are preserved from source paths rather than recalculated.
crown_top_up_values_missing,Include Crown top-up roll-up treatment,missing,Exclude,excluded_by_selection,Crown top-up Include is not applied because no governed top-up value rows are present in the source pack.
quarterly_source_pack_missing,Quarterly Revenue Outlook from source pack,missing,Annual,annual_only_source_pack,The distilled source pack is annual only; quarterly views use promoted Forecast Builder volume packs where available.
ped_total_vkt_bridge_missing,PED VKT per capita to total VKT bridge replay,missing,Total RUC+PED revenue,reported_gap,PED total VKT bridge rows are absent; PED revenue paths are preserved from workbook source rows rather than recomputed.
